date,topic
2025-01-29,Сновидения и их значение в жизни человека
2025-01-30,Как сны влияют на психику человека?
2025-01-31,Почему сбываются сны?
2025-02-01,Как нейросеть может анализировать сновидения?
2025-02-02,Как управлять своими снами? Техника осознанных сновидений
2025-02-03,Сновидения: факты и мифы
2025-02-04,Современные методы интерпретации снов
2025-02-05,Как фильмы о снах открывают новые горизонты восприятия реальности
2025-02-06,Скрытые страхи и желания которые раскрывают наши ночные образы
2025-02-07,Пустая комната как метафора внутреннего состояния в снах
2025-02-08,Море во сне: что оно символизирует для нашего подсознания
2025-02-09,Как животные в снах раскрывают архетипы и важные послания
2025-02-10,Повторяющиеся сны: какие скрытые значения они могут нести
2025-02-11,Рыба во сне: символ процветания или духовной трансформации
2025-02-12,Влияние снов на принятие решений: как они могут формировать нашу реальность
2025-02-13,Забытые сны: почему они так важны для понимания себя
2025-02-14,Сны как средство борьбы с тревогами и беспокойством
2025-02-15,Зомби в снах: связь с забытыми страхами и внутренними блоками
2025-02-16,Рекомендации по книгам для глубокого понимания сновидений
2025-02-17,Зеркала в снах: как они отражают наше восприятие реальности
2025-02-18,Ритуалы перед сном для предотвращения ночных кошмаров
2025-02-19,Что значит сон о доме? Как интерпретировать этот символ
2025-02-20,Факты и мифы о снах которые стоит знать каждому
2025-02-21,Как качество сна влияет на физическое и психологическое состояние
2025-02-22,Сновидческие персонажи: их роль в наших снах
2025-02-23,Сновидения о дальних странах: почему нам снятся путешествия
2025-02-24,Символика воды в снах и её связь с нашими эмоциями
2025-02-25,Огонь в снах как символ очищения или разрушения
2025-02-26,Летать во сне: что символизирует этот опыт для нашего внутреннего мира
2025-02-27,Горы и пещеры в снах: как их интерпретировать для самопознания
2025-02-28,Как отличить сон от реальности и понять его значение
2025-03-01,Сны о прошлом: что они могут рассказать о нашем настоящем
2025-03-02,Новые исследования о снах и их связи с подсознанием
2025-03-03,Цвета в снах: как они влияют на восприятие реальности
2025-03-04,Животные как архетипы в снах
2025-03-05,Загадочные символы в снах и их разгадка
2025-03-06,Что такое сонный паралич и как его преодолеть
2025-03-07,Осознанные сны и техника их управления
2025-03-08,Забытые сны: что они могут сказать о нашем прошлом
2025-03-09,Сны как источник вдохновения для творчества
2025-03-10,Повторяющиеся сны: влияние на психику человека
2025-03-11,Сны как предсказания будущего
2025-03-12,Как кошмары раскрывают наши глубинные страхи
2025-03-13,Сны как откровения: секреты которые они раскрывают
2025-03-14,Лунный цикл и его влияние на сновидения
2025-03-15,Как культурные различия влияют на восприятие снов
2025-03-16,Анализ снов как путь к личностному росту
2025-03-17,Эмоции в снах и их связь с нашим состоянием
2025-03-18,Сновидческие сигналы: как правильно интерпретировать важные знаки
2025-03-19,Сны как отражение физического состояния
2025-03-20,Мистические сны и их символика
2025-03-21,Медитация и её влияние на сновидения
2025-03-22,Мифологические существа в снах: мары и ночные кошмары
2025-03-23,Древнегреческие боги и герои как символы в снах
2025-03-24,Мифологические существа вампиры и оборотни в снах
2025-03-25,Животные в мифах и их значение в сновидениях
2025-03-26,Мифы о смерти и их отражение в наших снах
2025-03-27,Мифология и ночные кошмары
2025-03-28,Мифологические боги и их влияние на сознание сновидца
2025-03-29,Символика снов в разных культурах
2025-03-30,Мифологические архетипы в снах
2025-03-31,Мифология и психология в наших снах
